{
  "$schema": "http://json-schema.org/draft-07/schema#",
  "type": "array",
  "items": {
    "type": "object",
    "properties": {
      "name": {
        "type": "string"
      },
      "email": {
        "anyOf": [
          {
            "type": "string",
            "format": "email"
          },
          {
            "type": "string",
            "maxLength": 0
          }
        ]
      },
      "country": {
        "type": "string",
        "pattern": "^[A-Z]{2}$"
      },
      "memberType": {
        "type": "string",
        "enum": ["active", "observer", "partner", "associate"]
      },
      "infoUrl": {
        "type": "string",
        "format": "uri"
      },
      "groupId": {
        "type": "string",
        "minLength": 7,
        "maxLength": 7
      },
      "profilePictureUrl": {
        "type": "string",
        "format": "uri"
      }
    },
    "required": ["name", "email", "country", "memberType"],
    "additionalProperties": false
  }
}
